{
 "schemaVersion": 3,
 "contractMigration": {
  "schemaId": "validation-results.v3",
  "previousSchemaId": "validation-results.v2",
  "fromSchemaVersion": 2,
  "toSchemaVersion": 3,
  "breaking": true,
  "policy": {
   "document": "docs/SCHEMA_VERSIONING_POLICY.md",
   "policyVersion": 1,
   "decisionRule": "language-subset",
   "note": "判定は新旧 2 つの schema だけで行う。artifact の中身は見ない"
  },
  "consumerAction": "**schemaVersion で分岐すること。**2 を期待する実装は 3 を受け取ったら停止する。v2 で「あってもなくてもよい」だった証拠の由来 3 欄が**必須**になり、余分な項目を禁じた。値そのものは v0.6.16 から入っていたので、**読む側の実装は変えなくてよい**——変わるのは「無いものを受け取りうるか」だけである。**artifact の配布名は変わらない。**",
  "renamedAssets": [
   {
    "from": "validation-results.v2.schema.json",
    "to": "validation-results.v3.schema.json",
    "reason": "schema ファイル名。artifact 側の名前は変わらない"
   }
  ],
  "history": [
   {
    "shippedIn": "v0.6.17",
    "previousRelease": "v0.6.16",
    "previousSchemaPath": "schemas/validation-results.v2.schema.json",
    "currentSchemaPath": "schemas/validation-results.v3.schema.json",
    "schemaVersionAtTheTime": 3,
    "versionWasHeld": false,
    "policyVerdict": "BUMP",
    "changes": [
     {
      "kind": "const-changed",
      "effect": "UNDECIDABLE",
      "schemaPointer": "/properties/schemaVersion/const",
      "instancePath": "$.schemaVersion",
      "from": 2,
      "to": 3,
      "reason": "版を上げた。**この回は条文どおりに上げている**"
     },
     {
      "kind": "constraint-tightened",
      "effect": "UNDECIDABLE",
      "schemaPointer": "/properties/testEvidence/oneOf",
      "instancePath": "$.testEvidence",
      "reason": "証拠の由来 3 欄（testCountsSha256 / testCountsGeneratedFromCommit / testCountsGeneratedAt）を必須にし、additionalProperties:false を入れた。**狭める変更だが、`oneOf` の中なので判定器は判定不能を返す**（枝の言語について単調でないため）。実測 2026-08-15 の判定は BUMP。外部監査は HOLD_RECORD を想定していたが、判定器の実測に従って版を上げた"
     },
     {
      "kind": "const-changed",
      "effect": "UNDECIDABLE",
      "schemaPointer": "/properties/contractMigration/properties/schemaId/const",
      "instancePath": "$.contractMigration.schemaId",
      "from": "validation-results.v2",
      "to": "validation-results.v3",
      "reason": "対応表が自分の版を名乗る欄。**版を上げたら必ず一緒に動く**"
     },
     {
      "kind": "const-changed",
      "effect": "UNDECIDABLE",
      "schemaPointer": "/properties/contractMigration/properties/previousSchemaId/const",
      "instancePath": "$.contractMigration.previousSchemaId",
      "from": "validation-results.v1",
      "to": "validation-results.v2",
      "reason": "対応表が自分の版を名乗る欄。**版を上げたら必ず一緒に動く**"
     },
     {
      "kind": "const-changed",
      "effect": "UNDECIDABLE",
      "schemaPointer": "/properties/contractMigration/properties/fromSchemaVersion/const",
      "instancePath": "$.contractMigration.fromSchemaVersion",
      "from": 1,
      "to": 2,
      "reason": "対応表が自分の版を名乗る欄。**版を上げたら必ず一緒に動く**"
     },
     {
      "kind": "const-changed",
      "effect": "UNDECIDABLE",
      "schemaPointer": "/properties/contractMigration/properties/toSchemaVersion/const",
      "instancePath": "$.contractMigration.toSchemaVersion",
      "from": 2,
      "to": 3,
      "reason": "対応表が自分の版を名乗る欄。**版を上げたら必ず一緒に動く**"
     }
    ]
   }
  ]
 },
 "generatedBy": "npm run release:evidence",
 "generatedAt": "2026-10-28",
 "generatedFromCommit": "91a2f4aa0a7aee3680b6a42ff6788865ae0ce074",
 "command": "npm run validate:profiles",
 "targetsTotal": 14,
 "targetsPassed": 14,
 "allPassed": true,
 "artifactValidationStatus": "PASS",
 "releaseReadinessStatus": "READY",
 "releaseReadinessReasons": [],
 "testEvidence": {
  "total": 1481,
  "failed": 0,
  "skipped": 0,
  "exitCode": 0,
  "allPassed": true,
  "testCountsSha256": "97691b71e26753986ea7caae519bb8a6d97b7de177f87d94df948f5826df3241",
  "testCountsGeneratedFromCommit": "91a2f4aa0a7aee3680b6a42ff6788865ae0ce074",
  "testCountsGeneratedAt": "2026-10-28"
 },
 "distributedTargets": 10,
 "sourceOnlyTargets": 4,
 "results": [
  {
   "artifact": "artifacts/half_plug_topology_profile.v3.trs_jack_trs.json",
   "schema": "schemas/half-plug-topology-profile.v3.schema.json",
   "missing": false,
   "distribution": "RELEASE_ASSET",
   "schemaErrorCount": 0,
   "semanticErrorCount": 0,
   "schemaErrors": [],
   "semanticErrors": []
  },
  {
   "artifact": "artifacts/half_plug_topology_profile.v3.trs_jack_trrs.json",
   "schema": "schemas/half-plug-topology-profile.v3.schema.json",
   "missing": false,
   "distribution": "RELEASE_ASSET",
   "schemaErrorCount": 0,
   "semanticErrorCount": 0,
   "schemaErrors": [],
   "semanticErrors": []
  },
  {
   "artifact": "artifacts/topology_search_difference_signal.json",
   "schema": "schemas/topology-search.v1.schema.json",
   "missing": false,
   "distribution": "SOURCE_ONLY",
   "schemaErrorCount": 0,
   "semanticErrorCount": 0,
   "schemaErrors": [],
   "semanticErrors": []
  },
  {
   "artifact": "artifacts/real_jack_comparison.json",
   "schema": "schemas/real-jack-comparison.v1.schema.json",
   "missing": false,
   "distribution": "SOURCE_ONLY",
   "schemaErrorCount": 0,
   "semanticErrorCount": 0,
   "schemaErrors": [],
   "semanticErrors": []
  },
  {
   "artifact": "artifacts/test_counts.json",
   "schema": "schemas/test-counts.v2.schema.json",
   "missing": false,
   "distribution": "RELEASE_ASSET",
   "schemaErrorCount": 0,
   "semanticErrorCount": 0,
   "schemaErrors": [],
   "semanticErrors": []
  },
  {
   "artifact": "artifacts/sensitivity.trs_jack_trs.json",
   "schema": "schemas/event-sensitivity.v2.schema.json",
   "missing": false,
   "distribution": "RELEASE_ASSET",
   "schemaErrorCount": 0,
   "semanticErrorCount": 0,
   "schemaErrors": [],
   "semanticErrors": []
  },
  {
   "artifact": "artifacts/sensitivity.trs_jack_trrs.json",
   "schema": "schemas/event-sensitivity.v2.schema.json",
   "missing": false,
   "distribution": "RELEASE_ASSET",
   "schemaErrorCount": 0,
   "semanticErrorCount": 0,
   "schemaErrors": [],
   "semanticErrors": []
  },
  {
   "artifact": "artifacts/topology-robustness.trs_jack_trrs.json",
   "schema": "schemas/topology-robustness.v3.schema.json",
   "missing": false,
   "distribution": "RELEASE_ASSET",
   "schemaErrorCount": 0,
   "semanticErrorCount": 0,
   "schemaErrors": [],
   "semanticErrors": []
  },
  {
   "artifact": "artifacts/source-input-manifest.json",
   "schema": "schemas/source-input-manifest.v2.schema.json",
   "missing": false,
   "distribution": "RELEASE_ASSET",
   "schemaErrorCount": 0,
   "semanticErrorCount": 0,
   "schemaErrors": [],
   "semanticErrors": []
  },
  {
   "artifact": "source-input-scope.v1.json",
   "schema": "schemas/source-input-scope.v1.schema.json",
   "missing": false,
   "distribution": "RELEASE_ASSET",
   "schemaErrorCount": 0,
   "semanticErrorCount": 0,
   "schemaErrors": [],
   "semanticErrors": []
  },
  {
   "artifact": "artifacts/source-snapshot.v1.json",
   "schema": "schemas/source-snapshot.v1.schema.json",
   "missing": false,
   "distribution": "RELEASE_ASSET",
   "schemaErrorCount": 0,
   "semanticErrorCount": 0,
   "schemaErrors": [],
   "semanticErrors": []
  },
  {
   "artifact": "contract-migration.v1.json",
   "schema": "schemas/contract-migration.v1.schema.json",
   "missing": false,
   "distribution": "RELEASE_ASSET",
   "schemaErrorCount": 0,
   "semanticErrorCount": 0,
   "schemaErrors": [],
   "semanticErrors": []
  },
  {
   "artifact": "package.json",
   "schema": null,
   "missing": false,
   "distribution": "SOURCE_ONLY",
   "schemaErrorCount": 0,
   "semanticErrorCount": 0,
   "schemaErrors": [],
   "semanticErrors": []
  },
  {
   "artifact": "docs/measurements/measurement-records.v1.json",
   "schema": "schemas/measurement-record.v1.schema.json",
   "missing": false,
   "distribution": "SOURCE_ONLY",
   "schemaErrorCount": 0,
   "semanticErrorCount": 0,
   "schemaErrors": [],
   "semanticErrors": []
  }
 ],
 "note": "**この結果は生成時点のこのリポジトリでの判定である。**受け手の環境で同じ判定になることは、同梱の schema で自分で検証して確かめること。判定の実装は scripts/validateProfiles.mjs にある。**distribution: SOURCE_ONLY の対象は bundle に入っていない**ので、受け手はそれを再検証できない。"
}
